{
  "base_model_fingerprint": "sha256:79f294c643438ac7a494e4871857244c2de0eefa536eda5977af20640a301a22",
  "draft_id": "add-beam-1",
  "evidence_refs": [
    "resolved:/operations/add-beam-1/context/candidate_targets/0"
  ],
  "operations": [
    {
      "evidence_refs": [
        "resolved:/operations/add-beam-1/context/candidate_targets/0"
      ],
      "operation_id": "add-beam-1",
      "operation_type": "add_beam",
      "parameters": {
        "axis": {
          "end": {
            "x_mm": 31000,
            "y_mm": 58000,
            "z_mm": 3000
          },
          "start": {
            "x_mm": 25000,
            "y_mm": 58000,
            "z_mm": 3000
          }
        },
        "section": {
          "height_mm": 800,
          "shape": "rectangle",
          "width_mm": 500
        }
      },
      "target": {
        "storey_global_id": "02GkOQJZz4x9WAhoZkM67S"
      }
    }
  ],
  "postconditions": [
    "beam_geometry_matches",
    "beam_contained_in_storey",
    "beam_type_bound"
  ],
  "preconditions": [
    "target_exists",
    "structural_axis_available",
    "structural_type_authorized"
  ],
  "schema_version": "text2ifc/ifc-repair-changeset-draft/0.3",
  "scope": {
    "forbidden_ids": [],
    "target_ids": [
      "02GkOQJZz4x9WAhoZkM67S"
    ]
  },
  "semantic_manifest_ref": "changeset/semantic-manifest-add-beam-1.json",
  "semantic_manifest_sha256": "sha256:67da4eba942eca98061a90901b28af50438272ceea49cf9e04388472dd46d8cf",
  "semantic_summary": {
    "conditional": 3,
    "not_required": 0,
    "required": 2
  },
  "source_request_hash": "sha256:fe084ed99b6c038aec419b5181f7fab22834c9f80d6e133c263a6b76f2da01c0"
}
